{
  "artifacts": {
    "sdist": {
      "entry_count": 129,
      "name": "slaif_local_coding-0.1.0.tar.gz",
      "sha256": "6353491d3bbe603ba49e19a8af3d7f8664e74f400af07fe53779b26d08d06406",
      "size_bytes": 497695
    },
    "wheel": {
      "entry_count": 27,
      "name": "slaif_local_coding-0.1.0-py3-none-any.whl",
      "sha256": "eb241dda2e079b29190868108c488edaf98261c84119bfd405070dea98b546b9",
      "size_bytes": 82509
    }
  },
  "build": {
    "backend": {
      "name": "hatchling",
      "version": "1.32.0"
    },
    "build_environment": {
      "hatchling": "1.32.0",
      "packaging": "26.3",
      "pathspec": "1.1.1",
      "pluggy": "1.6.0",
      "tomlkit": "0.15.1",
      "trove-classifiers": "2026.6.1.19"
    },
    "python": {
      "observed_exact": [
        "3.12.14",
        "3.12.3"
      ],
      "runtime_requirement": ">=3.12",
      "wheel_patch_independent": true
    },
    "uv_version": "0.12.5"
  },
  "candidate": {
    "cutover_performed": false,
    "final_public_release": false,
    "private_registry_auth_required": true,
    "rc_identifier": "0.1.0-rc9",
    "state": "rc_published"
  },
  "gateway_peer": {
    "client_module": {
      "module_id": "codex-0.149-responses-v1",
      "module_version": "4"
    },
    "commit": "08ca421bee1ddca62078302b910e8be88cf705be",
    "repository": "ulfe-lmi/slaif-api-gateway",
    "server_module": {
      "module_id": "local-coding-v1",
      "module_version": "2",
      "replay_mode": "process_local_inclusive_horizon_fail_closed"
    }
  },
  "generated_from": {
    "git_commit": "9ee7ae12c8dbf8317c4bac8a97f6a4b1c49553a3",
    "repository": "ulfe-lmi/slaif-local-coding"
  },
  "limitations": [
    "two supported deployment paths: Docker (canonical installation path) and systemd user service on the local host (secondary direct-host path, including the protected-host cutover path)",
    "Docker qualified in CI and disposable environments only; deployment-qualified (disposable/CI environments only), not release-qualified",
    "LAN-visible binding law in force (D1): a non-loopback adapter bind is legal only under the full signed ingress contract (service_bearer_signed_identity_v1); loopback remains the default",
    "cutover not performed",
    "RC 0.1.0-rc9 (product 0.1.0) published to ghcr.io/ulfe-lmi/slaif-local-coding (PRIVATE registry; private-auth required) at digest sha256:54fe19483f00ef6e209b2796786fe27cddd302c6bcf5322821b2192a32884334 with tags 0.1.0-rc9 and sha-7f601bf153ef86a567883c0008edf4ce34e79c95; image source commit 7f601bf153ef86a567883c0008edf4ce34e79c95; the digest is the authoritative identity and tags are aliases; final_public_release remains false \u2014 a final public release is a separate later decision",
    "publication is registry-only: no protected-host cutover, no real deployment yet evidenced; the protected-host cutover remains a separate human-authorized act",
    "sdist is a developer-only source archive, not a supported release artifact",
    "no multi-user, production-certification, compliance, or frontier-equivalence claim",
    "single RTX 3090 fixture evidence is fixture-scoped, not generic production equivalence",
    "artifacts regenerated by objective 015-b (superseding the objective 015-a RC8 regeneration; the objective 014-d RC6 attempt was abandoned before any push, tag, or publication, so no RC6 identity exists and none is claimed) on explicitly authorized inputs only (fail-closed source-reference binding and the prepublication record-present rehearsal with the corrected single qualified source boundary: RC4 0.1.0-rc4 / source 601a7f9fae19869ad8e09f10fa994550368fd87c was rejected as release candidate because the committed provenance bound a later source-input map to the earlier immutable image source (its scoped real-Codex smoke passed per the immutable testing ledger 003); RC5 0.1.0-rc5 / source e04b4a99afa6268c98f28ed7abfc1db506107523 / wheel 897ef60568e9521dbb4ea563f297608e4409e02d54109471e789d43ff57dd10d passed its scoped real-Codex qualification per the immutable testing ledger 004 but was rejected as release candidate because a mandatory record-present gate required a tracked source correction after the immutable candidate freeze; RC7 0.1.0-rc7 / source ae6271318627703785f42de57d893c9be3b980c9 / wheel 897ef60568e9521dbb4ea563f297608e4409e02d54109471e789d43ff57dd10d passed its product state, its scoped real-Codex qualification per the immutable testing ledger 005, and its pulled-image qualification, and is archived byte-identical under packaging/releases/0.1.0-rc7/; RC8 0.1.0-rc8 / source 718fff301bed0a5ba93b29196cde4d0bcc5d711a / wheel eb241dda2e079b29190868108c488edaf98261c84119bfd405070dea98b546b9 repaired the independently verified product defects P01/P02, passed its product state, its scoped real-Codex qualification per the immutable testing ledger 006, and its pulled-image qualification, and is archived byte-identical under packaging/releases/0.1.0-rc8/; RC9 is the collision-safe successor candidate); fully pinned hermetic build environment enforced by [build-system].requires; deterministic hatchling==1.32.0 backend reproduces the clean-source wheel; the historical wheel 879baa3ad19e0f513090add965d267957d27f7bcd904d1e225586d76126f8b19, the historical private 0.1.0 registry digest, the RC2 identity (archived under packaging/releases/0.1.0-rc2/), the rejected RC3 identity (archived byte-identical under packaging/releases/0.1.0-rc3/), the rejected RC4 identity (archived byte-identical under packaging/releases/0.1.0-rc4/), the rejected RC5 identity (archived byte-identical under packaging/releases/0.1.0-rc5/), the RC7 identity (archived byte-identical under packaging/releases/0.1.0-rc7/), and the RC8 identity (archived byte-identical under packaging/releases/0.1.0-rc8/) are NOT reused for RC9; objective-010-a wheel hash 8678e16b41bd9d73849a956c9d1f25235532eaf52c772fc695718b2063b54472 remains the accepted 010 record only, not any current authority"
  ],
  "objective": "015-b",
  "oci": {
    "base_image": {
      "digest": "sha256:782412e85d0f0984994c290652577d4018aff08145c85b262bb63dc0c7522254",
      "name": "python:3.12-slim-bookworm"
    },
    "build_base_image": {
      "digest": "sha256:782412e85d0f0984994c290652577d4018aff08145c85b262bb63dc0c7522254",
      "name": "python:3.12-slim-bookworm"
    },
    "build_tool_image": {
      "digest": "sha256:e85be844203885286c60ffad8a858d48afb6c5a5c237ca0e67f12e74b8f174b1",
      "name": "ghcr.io/astral-sh/uv:0.12.5"
    },
    "candidate_tag": "0.1.0-rc9",
    "compose_sha256": "0928c9a66e808bb7d13118dffc22e61ce338157260b43b195ba0e7295f6332f3",
    "dockerfile_sha256": "a89d6a924f119cf0a9dd6124afe47eee60fb008cbd0d2e482de9b186f2974c22",
    "dockerignore_sha256": "b82e057eebcae9bc37bdc6700a2f0fa5bd4542e5df7ef9009aebfa481dbed482",
    "image_digest": "sha256:54fe19483f00ef6e209b2796786fe27cddd302c6bcf5322821b2192a32884334",
    "image_reference": "ghcr.io/ulfe-lmi/slaif-local-coding",
    "labels": {
      "org.opencontainers.image.source": "https://github.com/ulfe-lmi/slaif-local-coding",
      "org.opencontainers.image.version": "0.1.0",
      "slaif-local-coding.gateway.peer.sha": "08ca421bee1ddca62078302b910e8be88cf705be",
      "slaif-local-coding.package.version": "0.1.0",
      "slaif-local-coding.qualification": "rc-candidate-0.1.0-rc9; private; not final release",
      "slaif-local-coding.topology.mode": "linux-docker-host-network;loopback-default;lan-visible-only-with-full-signed-ingress",
      "slaif-local-coding.wheel.sha256": "eb241dda2e079b29190868108c488edaf98261c84119bfd405070dea98b546b9"
    },
    "published": true,
    "tag_convention": "published RC reference ghcr.io/ulfe-lmi/slaif-local-coding tags 0.1.0-rc9 + sha-<full image-source SHA> (private registry; digest sha256:54fe19483f00ef6e209b2796786fe27cddd302c6bcf5322821b2192a32884334 recorded in packaging/rc_record.json and this manifest; the digest is the authoritative identity, tags are aliases); local qualification tags slaif-local-coding:0.1.0-<sha> via compose.build.yaml",
    "wheel_sha256": "eb241dda2e079b29190868108c488edaf98261c84119bfd405070dea98b546b9"
  },
  "reference_compatibility": {
    "codex_client": {
      "version": "0.149.0",
      "wire_fixture_dir": "tests/fixtures/codex/0.149.0"
    },
    "model_name": "qwen3.8-27b",
    "upstream_interface": "vllm-openai-compat-v1"
  },
  "runtime": {
    "package_name": "slaif-local-coding",
    "package_version": "0.1.0",
    "pyproject_sha256": "2a078535af87cf9433cfb9d6b913697931e1946ade71f3d6ead0e4617add88b3",
    "python": "3.12",
    "uv_lock_sha256": "1237cbd179f71b99984c80f927529549f5e61eb705585ef9cf2ab0fa9e26764a"
  },
  "schema": "slaif-release-provenance-v5",
  "schema_version": 5,
  "source_inputs": {
    ".dockerignore": "b82e057eebcae9bc37bdc6700a2f0fa5bd4542e5df7ef9009aebfa481dbed482",
    ".github/workflows/ci.yml": "a10ec602a1fefea8270449f553d151184ce4c8e69e985c9cc4b463d1ca38dfeb",
    "CONTRIBUTING.md": "ef3a21206d990fcf8b586f65080a63640c2c77333a09aa152248c46a713310e6",
    "Dockerfile": "a89d6a924f119cf0a9dd6124afe47eee60fb008cbd0d2e482de9b186f2974c22",
    "INSTALL.md": "4b4ceb5159d3fa6c1d35e6aea22235d37624fdfe811e40894954d1fa35d54514",
    "LICENSE": "cfc7749b96f63bd31c3c42b5c471bf756814053e847c10f3eb003417bc523d30",
    "NOTICE": "95034243e7bde9fa107444a2c49d29966d989410498cff304cd867caf2879c3b",
    "QUICKSTART.md": "db325ea74268a57fbcff990e07537c6bc0999c0fedc99c9629199276d63d56e7",
    "README.md": "c7f87fb920cd6f0f24ad5cf6574c35441e44a6ce7538c2f93fd9a60ec3d87585",
    "THIRD_PARTY_NOTICES.md": "dfcf961bd169c5b6c3d977c912c063286728e0007481a27e18c492d3508dfc24",
    "compose.build.yaml": "954138d4831bd8abbba7100ca3364fb3180d7f39b6d309bed23e727b51359adb",
    "compose.yaml": "0928c9a66e808bb7d13118dffc22e61ce338157260b43b195ba0e7295f6332f3",
    "config/adapter.deployment.template.toml": "e4838be16ed1c5fc3f698a6e10246be61148a498ade61d0a8c11986cf42ed565",